{
  "schemaVersion": 1,
  "binding": {
    "id": "main-screen",
    "sourceUrl": "https://www.figma.com/design/replace-locally/sample?node-id=2-1",
    "fileKey": "replace-locally",
    "pageId": "1:1",
    "nodeId": "2:1",
    "boundAt": "2026-09-17T03:00:00Z",
    "verifiedFileName": "Sample UI",
    "verifiedPageName": "Main"
  },
  "project": {
    "name": "sample-project",
    "figmaFileName": "Sample UI",
    "summary": "用于展示 source、summary 与 generated output 的关系"
  },
  "pages": [
    {
      "id": "1:1",
      "name": "Main",
      "purpose": "示例页面",
      "editable": true
    }
  ],
  "regions": [
    {
      "nodeId": "2:1",
      "name": "Source Content",
      "semanticRole": "source-content",
      "editable": true,
      "sourceOfTruth": "docs/source.md"
    },
    {
      "nodeId": "2:2",
      "name": "Summary View",
      "semanticRole": "summary-view",
      "editable": true,
      "summarizes": ["2:1"]
    },
    {
      "nodeId": "2:3",
      "name": "Generated Output",
      "semanticRole": "generated-output",
      "editable": false,
      "derivedFrom": ["2:1"]
    }
  ],
  "designSystem": {
    "referencePages": ["3:1"],
    "preferredComponentSets": [],
    "preferredVariableCollections": [],
    "preferredTextStyles": []
  },
  "constraints": {
    "forbidDelete": true,
    "forbidCrossPageWrites": true,
    "protectedNodeIds": ["2:3"]
  },
  "validation": {
    "requireMeaningfulNames": true,
    "rejectMixedTypography": true,
    "rejectOverflow": true,
    "rejectOutOfBounds": true,
    "allowedOverlaps": []
  },
  "evidence": {
    "root": ".figma-agent",
    "gitIgnored": true,
    "saveScript": true,
    "saveStructuredResult": true,
    "saveTargetVerification": true,
    "allowSanitizedCommit": true
  },
  "sources": []
}
